{
  "$schema": "https://json-schema.org/draft/2020-12/schema",
  "$id": "ai-organization-officer.process-replication-candidate.v1",
  "type": "object",
  "required": [
    "schemaVersion",
    "taskId",
    "enterpriseId",
    "version",
    "upstreamAssets",
    "processDiagnosis",
    "processMap",
    "responsibilityMatrix",
    "sops",
    "formsAndApprovals",
    "knowledgeBase",
    "attendanceSystem",
    "payrollSystem",
    "employeeLifecycle",
    "laborCompliance",
    "replicationPackage",
    "pilotPlan",
    "versionGovernance",
    "evidenceIndex",
    "unknowns",
    "risks",
    "decisionsRequired",
    "createdAt"
  ],
  "properties": {
    "schemaVersion": {"const": 1},
    "taskId": {"type": "string"},
    "enterpriseId": {"type": "string"},
    "version": {"type": "integer", "minimum": 1},
    "upstreamAssets": {"type": "object"},
    "processDiagnosis": {"type": "object"},
    "processMap": {"type": "object"},
    "responsibilityMatrix": {"type": "array", "minItems": 1},
    "sops": {"type": "array", "minItems": 1},
    "formsAndApprovals": {"type": "object"},
    "knowledgeBase": {"type": "object"},
    "attendanceSystem": {"type": "object"},
    "payrollSystem": {"type": "object"},
    "employeeLifecycle": {"type": "object"},
    "laborCompliance": {"type": "object"},
    "replicationPackage": {"type": "object"},
    "pilotPlan": {"type": "object"},
    "versionGovernance": {"type": "object"},
    "evidenceIndex": {"type": "array", "minItems": 1},
    "unknowns": {"type": "array"},
    "risks": {"type": "array"},
    "decisionsRequired": {"type": "array", "minItems": 1},
    "createdAt": {"type": "string", "format": "date-time"}
  }
}
