{
  "schemaVersion": 1,
  "taskId": "YYYYMMDD-NNN-process-replication",
  "enterpriseId": "enterprise-id",
  "version": 1,
  "upstreamAssets": {
    "talentAllocation": {
      "capabilityId": "talent-allocation",
      "version": 1,
      "candidateSha256": "64位SHA-256",
      "formalAssetSha256": "64位SHA-256",
      "formalAssetRef": "精确版本路径"
    },
    "talentDevelopment": {
      "capabilityId": "talent-development",
      "version": 1,
      "candidateSha256": "64位SHA-256",
      "formalAssetSha256": "64位SHA-256",
      "formalAssetRef": "精确版本路径"
    }
  },
  "processDiagnosis": {},
  "processMap": {},
  "responsibilityMatrix": [],
  "sops": [],
  "formsAndApprovals": {},
  "knowledgeBase": {},
  "attendanceSystem": {
    "mode": "template-only",
    "pilot": {
      "fullCycleCovered": false,
      "unresolvedExceptions": []
    }
  },
  "payrollSystem": {
    "mode": "template-only",
    "shadowRun": {
      "completed": false,
      "unexplainedDifferences": []
    }
  },
  "employeeLifecycle": {},
  "laborCompliance": {},
  "replicationPackage": {},
  "pilotPlan": {},
  "versionGovernance": {},
  "evidenceIndex": [],
  "unknowns": [],
  "risks": [],
  "decisionsRequired": [],
  "createdAt": "ISO-8601"
}
